director_name,actor_1_name,actor_2_name,actor_3_name,genres,movie_title,comb
Sally Potter,Timothy Spall,Kristin Scott Thomas,Patricia Clarkson,Comedy,the party,Timothy Spall Kristin Scott Thomas Patricia Clarkson Sally Potter Comedy
Mark Pellington,Jon Hamm,Nick Offerman,Amber Tamblyn,Drama,nostalgia,Jon Hamm Nick Offerman Amber Tamblyn Mark Pellington Drama
Lance Daly,Hugo Weaving,Jim Broadbent,Stephen Rea,Drama Western,black '47,Hugo Weaving Jim Broadbent Stephen Rea Lance Daly Drama Western
Bruce Macdonald,Taylor James,Jackson Rathbone,Billy Zane,Action Drama Adventure,samson,Taylor James Jackson Rathbone Billy Zane Bruce Macdonald Action Drama Adventure
"Jonathan Goldstein, John Francis Daley",Jason Bateman,Rachel McAdams,Kyle Chandler,Mystery Comedy Crime,game night,"Jason Bateman Rachel McAdams Kyle Chandler Jonathan Goldstein, John Francis Daley Mystery Comedy Crime"
Alex Garland,Natalie Portman,Jennifer Jason Leigh,Gina Rodriguez,Action Science Fiction Horror Mystery,annihilation,Natalie Portman Jennifer Jason Leigh Gina Rodriguez Alex Garland Action Science Fiction Horror Mystery
Michael Sucsy,Angourie Rice,Maria Bello,Debby Ryan,Drama Fantasy Romance,every day,Angourie Rice Maria Bello Debby Ryan Michael Sucsy Drama Fantasy Romance
David Freyne,David Freyne (director); Ellen Page,Sam Keeley,Tom Vaughan-Lawlor,Horror Drama Science Fiction,the cured,David Freyne (director); Ellen Page Sam Keeley Tom Vaughan-Lawlor David Freyne Horror Drama Science Fiction
Brian O'Malley,Charlotte Vega,Bill Milner,Eugene Simon,Drama Horror Romance Thriller,the lodgers,Charlotte Vega Bill Milner Eugene Simon Brian O'Malley Drama Horror Romance Thriller
Francis Lawrence,Jennifer Lawrence,Joel Edgerton,Matthias Schoenaerts,Mystery Thriller,red sparrow,Jennifer Lawrence Joel Edgerton Matthias Schoenaerts Francis Lawrence Mystery Thriller
Eli Roth,Bruce Willis,Vincent D'Onofrio,Dean Norris,Action Crime Drama Thriller,death wish,Bruce Willis Vincent D'Onofrio Dean Norris Eli Roth Action Crime Drama Thriller
Shawn Christensen,Logan Lerman,Elle Fanning,Michelle Monaghan,Mystery Drama,the vanishing of sidney hall,Logan Lerman Elle Fanning Michelle Monaghan Shawn Christensen Mystery Drama
Samuel Maoz,Lior Ashkenazi,Sarah Adler,Yonatan Shiray,Comedy Drama War,foxtrot,Lior Ashkenazi Sarah Adler Yonatan Shiray Samuel Maoz Comedy Drama War
Usher Morgan,Elyse Price,Joel Bernard,Katie Vincent,Thriller Action Crime Drama Mystery,pickings,Elyse Price Joel Bernard Katie Vincent Usher Morgan Thriller Action Crime Drama Mystery
Ava DuVernay,Storm Reid,Oprah Winfrey,Reese Witherspoon,Adventure Science Fiction Family Fantasy,a wrinkle in time,Storm Reid Oprah Winfrey Reese Witherspoon Ava DuVernay Adventure Science Fiction Family Fantasy
Nash Edgerton,David Oyelowo,Charlize Theron,Joel Edgerton,Comedy Action,gringo,David Oyelowo Charlize Theron Joel Edgerton Nash Edgerton Comedy Action
Cory Finley,Olivia Cooke,Anya Taylor-Joy,Anton Yelchin,Drama Thriller,thoroughbreds,Olivia Cooke Anya Taylor-Joy Anton Yelchin Cory Finley Drama Thriller
Armando Iannucci,Steve Buscemi,Simon Russell Beale,Paddy Considine,Comedy Drama History,the death of stalin,Steve Buscemi Simon Russell Beale Paddy Considine Armando Iannucci Comedy Drama History
Paolo Virzì,Donald Sutherland,Helen Mirren,unknown,Drama Romance Adventure,the leisure seeker,Donald Sutherland Helen Mirren unknown Paolo Virzì Drama Romance Adventure
Johannes Roberts,Christina Hendricks,Martin Henderson,Bailee Madison,Horror Thriller,the strangers: prey at night,Christina Hendricks Martin Henderson Bailee Madison Johannes Roberts Horror Thriller
Rob Cohen,Toby Kebbell,Maggie Grace,Ryan Kwanten,Action Crime Thriller,the hurricane heist,Toby Kebbell Maggie Grace Ryan Kwanten Rob Cohen Action Crime Thriller
Roar Uthaug,Alicia Vikander,Dominic West,Walton Goggins,Action Adventure Fantasy,tomb raider,Alicia Vikander Dominic West Walton Goggins Roar Uthaug Action Adventure Fantasy
Greg Berlanti,Nick Robinson,Katherine Langford,Alexandra Shipp,Comedy Drama Romance,"love, simon",Nick Robinson Katherine Langford Alexandra Shipp Greg Berlanti Comedy Drama Romance
Jon Erwin,Cloris Leachman,Dennis Quaid,Priscilla Shirer,Music Drama,i can only imagine,Cloris Leachman Dennis Quaid Priscilla Shirer Jon Erwin Music Drama
José Padilha,Rosamund Pike,Daniel Brühl,Vincent Cassel,Thriller Drama Crime,7 days in entebbe,Rosamund Pike Daniel Brühl Vincent Cassel José Padilha Thriller Drama Crime
Laurie Collyer,Melissa Leo,Tessa Thompson,La La Anthony,Comedy,furlough,Melissa Leo Tessa Thompson La La Anthony Laurie Collyer Comedy
Eric England,Sophie Turner,Dylan McDermott,Jack Kilmer,Comedy Music,josie,Sophie Turner Dylan McDermott Jack Kilmer Eric England Comedy Music
Max Winkler,Zoey Deutch,Kathryn Hahn,Tim Heidecker,Drama Comedy,flower,Zoey Deutch Kathryn Hahn Tim Heidecker Max Winkler Drama Comedy
Steven S. DeKnight,John Boyega,Scott Eastwood,Cailee Spaeny,Action Fantasy Science Fiction Adventure,pacific rim: uprising,John Boyega Scott Eastwood Cailee Spaeny Steven S. DeKnight Action Fantasy Science Fiction Adventure
Wes Anderson,Bryan Cranston,Edward Norton,Bill Murray,Adventure Comedy Animation,isle of dogs,Bryan Cranston Edward Norton Bill Murray Wes Anderson Adventure Comedy Animation
John Stevenson,James McAvoy,Emily Blunt,Johnny Depp,Animation Family Fantasy Comedy Adventure Mystery,sherlock gnomes,James McAvoy Emily Blunt Johnny Depp John Stevenson Animation Family Fantasy Comedy Adventure Mystery
Steven Soderbergh,Claire Foy,Joshua Leonard,Jay Pharoah,Horror Thriller,unsane,Claire Foy Joshua Leonard Jay Pharoah Steven Soderbergh Horror Thriller
Andrew Hyatt,James Faulkner,Jim Caviezel,Olivier Martinez,Drama History,"paul, apostle of christ",James Faulkner Jim Caviezel Olivier Martinez Andrew Hyatt Drama History
Stanley Tucci,Geoffrey Rush,Armie Hammer,Clémence Poésy,Drama History,final portrait,Geoffrey Rush Armie Hammer Clémence Poésy Stanley Tucci Drama History
Scott Speer,Bella Thorne,Patrick Schwarzenegger,Rob Riggle,Romance Drama,midnight sun,Bella Thorne Patrick Schwarzenegger Rob Riggle Scott Speer Romance Drama
Ryan Justice,Amanda Delaney,Justin Maina,Sean Michael Gloria,Comedy Horror,followers,Amanda Delaney Justin Maina Sean Michael Gloria Ryan Justice Comedy Horror
Steven Spielberg,Tye Sheridan,Olivia Cooke,Ben Mendelsohn,Science Fiction Adventure Action,ready player one,Tye Sheridan Olivia Cooke Ben Mendelsohn Steven Spielberg Science Fiction Adventure Action
Tyler Perry,Taraji P. Henson,Lyriq Bent,Tika Sumpter,Thriller,tyler perry's acrimony,Taraji P. Henson Lyriq Bent Tika Sumpter Tyler Perry Thriller
Michael Mason,David A. R. White,John Corbett,Shane Harper,Drama,god's not dead: a light in darkness,David A. R. White John Corbett Shane Harper Michael Mason Drama
Aaron Katz,Lola Kirke,Zoë Kravitz,Greta Lee,Science Fiction Action Thriller,gemini,Lola Kirke Zoë Kravitz Greta Lee Aaron Katz Science Fiction Action Thriller
Adam Rifkin,Burt Reynolds,Ariel Winter,Clark Duke,Drama,the last movie star,Burt Reynolds Ariel Winter Clark Duke Adam Rifkin Drama
John Krasinski,John Krasinski,Emily Blunt,Millicent Simmonds,Science Fiction Thriller Horror,a quiet place,John Krasinski Emily Blunt Millicent Simmonds John Krasinski Science Fiction Thriller Horror
Kay Cannon,Leslie Mann,Ike Barinholtz,John Cena,Comedy,blockers,Leslie Mann Ike Barinholtz John Cena Kay Cannon Comedy
Lynne Ramsay,Joaquin Phoenix,Ekaterina Samsonov,Alex Manette,Thriller Drama,you were never really here,Joaquin Phoenix Ekaterina Samsonov Alex Manette Lynne Ramsay Thriller Drama
John Curran,Jason Clarke,Kate Mara,Ed Helms,History Drama Thriller,chappaquiddick,Jason Clarke Kate Mara Ed Helms John Curran History Drama Thriller
"Drew Fellman, David Douglas",Kristen Bell,unknown,unknown,Documentary,pandas,"Kristen Bell unknown unknown Drew Fellman, David Douglas Documentary"
Andrew Haigh,Charlie Plummer,Chloë Sevigny,Travis Fimmel,Drama Adventure,lean on pete,Charlie Plummer Chloë Sevigny Travis Fimmel Andrew Haigh Drama Adventure
Sean McNamara,Helen Hunt,William Hurt,Erin Moriarty,Drama,the miracle season,Helen Hunt William Hurt Erin Moriarty Sean McNamara Drama
Brad Anderson,Jon Hamm,Rosamund Pike,Dean Norris,Action Thriller Drama,beirut,Jon Hamm Rosamund Pike Dean Norris Brad Anderson Action Thriller Drama
Brad Peyton,Dwayne Johnson,Naomie Harris,Malin Åkerman,Action,rampage,Dwayne Johnson Naomie Harris Malin Åkerman Brad Peyton Action
Jeff Wadlow,Lucy Hale,Tyler Posey,Violett Beane,Thriller Horror,truth or dare,Lucy Hale Tyler Posey Violett Beane Jeff Wadlow Thriller Horror
Chloé Zhao,Brady Jandreau,unknown,unknown,Western Drama,the rider,Brady Jandreau unknown unknown Chloé Zhao Western Drama
Richard Lanni,Logan Lerman,Helena Bonham Carter,Gérard Depardieu,Animation Adventure Family History War,sgt. stubby: an american hero,Logan Lerman Helena Bonham Carter Gérard Depardieu Richard Lanni Animation Adventure Family History War
"Abby Kohn, Marc Silverstein",Amy Schumer,Michelle Williams,Emily Ratajkowski,Comedy Romance,i feel pretty,"Amy Schumer Michelle Williams Emily Ratajkowski Abby Kohn, Marc Silverstein Comedy Romance"
Jay Chandrasekhar,Jay Chandrasekhar,Paul Soter,Steve Lemme,Comedy Crime Mystery,super troopers 2,Jay Chandrasekhar Paul Soter Steve Lemme Jay Chandrasekhar Comedy Crime Mystery
Deon Taylor,Paula Patton,Omar Epps,Missi Pyle,Horror Thriller,traffik,Paula Patton Omar Epps Missi Pyle Deon Taylor Horror Thriller
Peter Livolsi,Asa Butterfield,Nick Offerman,Ellen Burstyn,Adventure,the house of tomorrow,Asa Butterfield Nick Offerman Ellen Burstyn Peter Livolsi Adventure
Naoko Yamada,Atsumi Tanezaki,Nao Tōyama,unknown,Animation Drama Music,liz and the blue bird,Atsumi Tanezaki Nao Tōyama unknown Naoko Yamada Animation Drama Music
Anthony Russo and Joe Russo,Robert Downey Jr.,Chris Hemsworth,Mark Ruffalo,Adventure Action Science Fiction,avengers: infinity war,Robert Downey Jr. Chris Hemsworth Mark Ruffalo Anthony Russo and Joe Russo Adventure Action Science Fiction
Sebastián Lelio,Rachel Weisz,Rachel McAdams,Alessandro Nivola,Drama Romance,disobedience,Rachel Weisz Rachel McAdams Alessandro Nivola Sebastián Lelio Drama Romance
Per Fly,Ben Kingsley,Theo James,Jacqueline Bisset,Thriller Drama History,backstabbing for beginners,Ben Kingsley Theo James Jacqueline Bisset Per Fly Thriller Drama History
Deniz Gamze Ergüven,Halle Berry,Daniel Craig,unknown,Adventure Drama Action,kings,Halle Berry Daniel Craig unknown Deniz Gamze Ergüven Adventure Drama Action
"Rob Greenberg, Bob Fisher",Anna Faris,Eugenio Derbez,Eva Longoria,Romance Comedy,overboard,"Anna Faris Eugenio Derbez Eva Longoria Rob Greenberg, Bob Fisher Romance Comedy"
Jason Reitman,Charlize Theron,Mackenzie Davis,Mark Duplass,Drama,tully,Charlize Theron Mackenzie Davis Mark Duplass Jason Reitman Drama
Dean Devlin,David Tennant,Robert Sheehan,Carlito Olivero,Thriller Crime Horror,bad samaritan,David Tennant Robert Sheehan Carlito Olivero Dean Devlin Thriller Crime Horror
Bobby Miller,Johnny Galecki,Anna Friel,Oliver Platt,Drama Comedy Fantasy,the cleanse,Johnny Galecki Anna Friel Oliver Platt Bobby Miller Drama Comedy Fantasy
Xavier Beauvois,Nathalie Baye,unknown,unknown,Family Animation Fantasy Action Adventure,the guardians,Nathalie Baye unknown unknown Xavier Beauvois Family Animation Fantasy Action Adventure
Ben Falcone,Melissa McCarthy,Maya Rudolph,Molly Gordon,Comedy,life of the party,Melissa McCarthy Maya Rudolph Molly Gordon Ben Falcone Comedy
James McTeigue,Gabrielle Union,Billy Burke,Richard Cabral,Thriller Crime Action Horror,breaking in,Gabrielle Union Billy Burke Richard Cabral James McTeigue Thriller Crime Action Horror
Michael Mayer,Saoirse Ronan,Annette Bening,Corey Stoll,Drama Romance Comedy,the seagull,Saoirse Ronan Annette Bening Corey Stoll Michael Mayer Drama Romance Comedy
Vaughn Stein,Margot Robbie,Simon Pegg,Dexter Fletcher,Comedy Drama,terminal,Margot Robbie Simon Pegg Dexter Fletcher Vaughn Stein Comedy Drama
Coralie Fargeat,Matilda Lutz,Kevin Janssens,Vincent Colombe,Animation Action Fantasy,revenge,Matilda Lutz Kevin Janssens Vincent Colombe Coralie Fargeat Animation Action Fantasy
David Leitch,Ryan Reynolds,Josh Brolin,Zazie Beetz,Action Comedy Adventure,deadpool 2,Ryan Reynolds Josh Brolin Zazie Beetz David Leitch Action Comedy Adventure
Bill Holderman,Jane Fonda,Candice Bergen,Mary Steenburgen,Comedy Romance Drama,book club,Jane Fonda Candice Bergen Mary Steenburgen Bill Holderman Comedy Romance Drama
Paul Schrader,Ethan Hawke,Amanda Seyfried,Cedric Kyles,Drama,first reformed,Ethan Hawke Amanda Seyfried Cedric Kyles Paul Schrader Drama
Wim Wenders,Wim Wenders (director); Pope Francis,unknown,unknown,Documentary,pope francis: a man of his word,Wim Wenders (director); Pope Francis unknown unknown Wim Wenders Documentary
Raja Gosnell,Will Arnett,Natasha Lyonne,Ludacris,Adventure Crime Family Comedy,show dogs,Will Arnett Natasha Lyonne Ludacris Raja Gosnell Adventure Crime Family Comedy
Ron Howard,Alden Ehrenreich,Woody Harrelson,Emilia Clarke,Science Fiction Adventure Action Crime,solo: a star wars story,Alden Ehrenreich Woody Harrelson Emilia Clarke Ron Howard Science Fiction Adventure Action Crime
John Cameron Mitchell,Elle Fanning,Alex Sharp,Nicole Kidman,Comedy Music Romance Science Fiction,how to talk to girls at parties,Elle Fanning Alex Sharp Nicole Kidman John Cameron Mitchell Comedy Music Romance Science Fiction
Anthony Byrne,Natalie Dormer,Emily Ratajkowski,Ed Skrein,Thriller Mystery,in darkness,Natalie Dormer Emily Ratajkowski Ed Skrein Anthony Byrne Thriller Mystery
Bruce LaBruce,Susanne Sachße,Viva Ruiz,Kembra Pfahler,Drama,the misandrists,Susanne Sachße Viva Ruiz Kembra Pfahler Bruce LaBruce Drama
"James Franco, Bruce Thierry Cheung",James Franco,Suki Waterhouse,Jeffrey Wahlberg,Science Fiction,future world,"James Franco Suki Waterhouse Jeffrey Wahlberg James Franco, Bruce Thierry Cheung Science Fiction"
Tim Kirkby,Johnny Knoxville,Chris Pontius,unknown,Comedy Drama,action point,Johnny Knoxville Chris Pontius unknown Tim Kirkby Comedy Drama
Baltasar Kormákur,Shailene Woodley,Sam Claflin,unknown,Thriller Romance Adventure,adrift,Shailene Woodley Sam Claflin unknown Baltasar Kormákur Thriller Romance Adventure
Leigh Whannell,Logan Marshall-Green,Betty Gabriel,Harrison Gilbertson,Action Thriller Science Fiction,upgrade,Logan Marshall-Green Betty Gabriel Harrison Gilbertson Leigh Whannell Action Thriller Science Fiction
Bart Layton,Evan Peters,Barry Keoghan,Blake Jenner,Drama Crime Documentary,american animals,Evan Peters Barry Keoghan Blake Jenner Bart Layton Drama Crime Documentary
Theresa Bennett,Noël Wells,Josh Radnor,Aya Cash,Comedy Romance,social animals,Noël Wells Josh Radnor Aya Cash Theresa Bennett Comedy Romance
Gary Ross,Sandra Bullock,Cate Blanchett,Anne Hathaway,Crime Comedy Action,ocean's 8,Sandra Bullock Cate Blanchett Anne Hathaway Gary Ross Crime Comedy Action
Morgan Neville,Morgan Neville (director); Fred Rogers,unknown,unknown,Documentary,won't you be my neighbor?,Morgan Neville (director); Fred Rogers unknown unknown Morgan Neville Documentary
Ari Aster,Toni Collette,Alex Wolff,Milly Shapiro,Horror Mystery Thriller,hereditary,Toni Collette Alex Wolff Milly Shapiro Ari Aster Horror Mystery Thriller
Drew Pearce,Jodie Foster,Sterling K. Brown,Sofia Boutella,Thriller Science Fiction Action,hotel artemis,Jodie Foster Sterling K. Brown Sofia Boutella Drew Pearce Thriller Science Fiction Action
Director X,Trevor Jackson,Jason Mitchell,Michael K. Williams,Action Crime,superfly,Trevor Jackson Jason Mitchell Michael K. Williams Director X Action Crime
Brad Bird,Craig T. Nelson,Holly Hunter,Sarah Vowell,Action Adventure Animation Family,incredibles 2,Craig T. Nelson Holly Hunter Sarah Vowell Brad Bird Action Adventure Animation Family
Jeff Tomsic,Ed Helms,Jeremy Renner,Jon Hamm,Comedy Action,tag,Ed Helms Jeremy Renner Jon Hamm Jeff Tomsic Comedy Action
Dominic Cooke,Saoirse Ronan,Billy Howle,Emily Watson,Drama Romance,on chesil beach,Saoirse Ronan Billy Howle Emily Watson Dominic Cooke Drama Romance
Kevin Connolly,John Travolta,Kelly Preston,Stacy Keach,Crime Drama History Thriller,gotti,John Travolta Kelly Preston Stacy Keach Kevin Connolly Crime Drama History Thriller
J.A. Bayona,Chris Pratt,Bryce Dallas Howard,Rafe Spall,Action Adventure Science Fiction,jurassic world: fallen kingdom,Chris Pratt Bryce Dallas Howard Rafe Spall J.A. Bayona Action Adventure Science Fiction
Shana Feste,Vera Farmiga,Christopher Plummer,Lewis MacDougall,Comedy Drama,boundaries,Vera Farmiga Christopher Plummer Lewis MacDougall Shana Feste Comedy Drama
"David Zellner, Nathan Zellner",Robert Pattinson,Mia Wasikowska,unknown,Comedy Western,damsel,"Robert Pattinson Mia Wasikowska unknown David Zellner, Nathan Zellner Comedy Western"
Mike P. Nelson,Tyler Hoechlin,Kate Bosworth,Lance Reddick,Thriller Horror,the domestics,Tyler Hoechlin Kate Bosworth Lance Reddick Mike P. Nelson Thriller Horror
Stefano Sollima,Benicio del Toro,Josh Brolin,Isabela Moner,Action Crime Drama Thriller,sicario: day of the soldado,Benicio del Toro Josh Brolin Isabela Moner Stefano Sollima Action Crime Drama Thriller
Debra Granik,Ben Foster,Thomasin McKenzie,Jeff Kober,Drama,leave no trace,Ben Foster Thomasin McKenzie Jeff Kober Debra Granik Drama
Charles Stone III,Kyrie Irving,Lil Rel Howery,Shaquille O'Neal,Comedy,uncle drew,Kyrie Irving Lil Rel Howery Shaquille O'Neal Charles Stone III Comedy
Susanna White,Jessica Chastain,Michael Greyeyes,Chaske Spencer,Drama History Western,woman walks ahead,Jessica Chastain Michael Greyeyes Chaske Spencer Susanna White Drama History Western
Gerard McMurray,Y'lan Noel,Lex Scott Davis,Joivan Wade,Action Science Fiction Thriller Horror Crime,the first purge,Y'lan Noel Lex Scott Davis Joivan Wade Gerard McMurray Action Science Fiction Thriller Horror Crime
Peyton Reed,Paul Rudd,Evangeline Lilly,Michael Peña,Action Adventure Science Fiction,ant-man and the wasp,Paul Rudd Evangeline Lilly Michael Peña Peyton Reed Action Adventure Science Fiction
Boots Riley,Lakeith Stanfield,Tessa Thompson,Armie Hammer,Fantasy Science Fiction Comedy,sorry to bother you,Lakeith Stanfield Tessa Thompson Armie Hammer Boots Riley Fantasy Science Fiction Comedy
Kevin MacDonald,Whitney Houston,unknown,unknown,Music Documentary,whitney,Whitney Houston unknown unknown Kevin MacDonald Music Documentary
Genndy Tartakovsky,Adam Sandler,Andy Samberg,Selena Gomez,Family Fantasy Comedy Animation,hotel transylvania 3: summer vacation,Adam Sandler Andy Samberg Selena Gomez Genndy Tartakovsky Family Fantasy Comedy Animation
Rawson Marshall Thurber,Dwayne Johnson,Neve Campbell,Chin Han,Action,skyscraper,Dwayne Johnson Neve Campbell Chin Han Rawson Marshall Thurber Action
Bo Burnham,Elsie Fisher,Josh Hamilton,Emily Robinson,Comedy Drama,eighth grade,Elsie Fisher Josh Hamilton Emily Robinson Bo Burnham Comedy Drama
Gus Van Sant,Joaquin Phoenix,Rooney Mara,Jonah Hill,Comedy Drama,"don't worry, he won't get far on foot",Joaquin Phoenix Rooney Mara Jonah Hill Gus Van Sant Comedy Drama
Rob Reiner,Woody Harrelson,Tommy Lee Jones,James Marsden,Drama History Thriller,shock and awe,Woody Harrelson Tommy Lee Jones James Marsden Rob Reiner Drama History Thriller
Ol Parker,Lily James,Amanda Seyfried,Pierce Brosnan,Comedy Romance,mamma mia! here we go again,Lily James Amanda Seyfried Pierce Brosnan Ol Parker Comedy Romance
Antoine Fuqua,Denzel Washington,Ashton Sanders,Pedro Pascal,Action Thriller Crime,the equalizer 2,Denzel Washington Ashton Sanders Pedro Pascal Antoine Fuqua Action Thriller Crime
Carlos López Estrada,Janina Gavankar,Ethan Embry,Daveed Diggs,Comedy Drama,blindspotting,Janina Gavankar Ethan Embry Daveed Diggs Carlos López Estrada Comedy Drama
Stephen Susco,Colin Woodell,Rebecca Rittenhouse,Betty Gabriel,Horror Mystery Thriller,unfriended: dark web,Colin Woodell Rebecca Rittenhouse Betty Gabriel Stephen Susco Horror Mystery Thriller
Shinsuke Sato,Shinsuke Sato (director); Sota Fukushi,Hana Sugisaki,unknown,Action Fantasy Adventure,bleach,Shinsuke Sato (director); Sota Fukushi Hana Sugisaki unknown Shinsuke Sato Action Fantasy Adventure
Édouard Deluc,Vincent Cassel,Tuheï Adams,Malik Zidi,Drama Romance,gauguin – voyage de tahiti,Vincent Cassel Tuheï Adams Malik Zidi Édouard Deluc Drama Romance
Christopher McQuarrie,Tom Cruise,Henry Cavill,Ving Rhames,Action Adventure,mission: impossible – fallout,Tom Cruise Henry Cavill Ving Rhames Christopher McQuarrie Action Adventure
Peter Rida Michail,Scott Menville,Khary Payton,Tara Strong,Animation Action Comedy Science Fiction,teen titans go! to the movies,Scott Menville Khary Payton Tara Strong Peter Rida Michail Animation Action Comedy Science Fiction
Tsui Hark,Tsui Hark (director),Chang Chia-lu,Chen Kuo-Fu (screenplay),Mystery Fantasy Adventure Action,detective dee: the four heavenly kings,Tsui Hark (director) Chang Chia-lu Chen Kuo-Fu (screenplay) Tsui Hark Mystery Fantasy Adventure Action
Elijah Bynum,Timothée Chalamet,Maika Monroe,Alex Roe,Drama Comedy,hot summer nights,Timothée Chalamet Maika Monroe Alex Roe Elijah Bynum Drama Comedy
Marc Turtletaub,Kelly Macdonald,Irrfan Khan,David Denman,Drama,puzzle,Kelly Macdonald Irrfan Khan David Denman Marc Turtletaub Drama
Marc Forster,Ewan McGregor,Hayley Atwell,Jim Cummings,Adventure Comedy Family Fantasy,christopher robin,Ewan McGregor Hayley Atwell Jim Cummings Marc Forster Adventure Comedy Family Fantasy
Jennifer Yuh Nelson,Amandla Stenberg,Mandy Moore,Harris Dickinson,Science Fiction Action Drama Romance Adventure Thriller,the darkest minds,Amandla Stenberg Mandy Moore Harris Dickinson Jennifer Yuh Nelson Science Fiction Action Drama Romance Adventure Thriller
Susanna Fogel,Mila Kunis,Kate McKinnon,Justin Theroux,Action Comedy,the spy who dumped me,Mila Kunis Kate McKinnon Justin Theroux Susanna Fogel Action Comedy
Desiree Akhavan,Chloë Grace Moretz,Sasha Lane,John Gallagher,Drama,the miseducation of cameron post,Chloë Grace Moretz Sasha Lane John Gallagher Desiree Akhavan Drama
Augustine Frizzell,Maia Mitchell,Camila Morrone,Kyle Mooney,Comedy,never goin' back,Maia Mitchell Camila Morrone Kyle Mooney Augustine Frizzell Comedy
Ken Marino,Nina Dobrev,Finn Wolfhard,Vanessa Hudgens,Romance Comedy Drama,dog days,Nina Dobrev Finn Wolfhard Vanessa Hudgens Ken Marino Romance Comedy Drama
Jon Turteltaub,Jason Statham,Li Bingbing,Rainn Wilson,Action Science Fiction Horror,the meg,Jason Statham Li Bingbing Rainn Wilson Jon Turteltaub Action Science Fiction Horror
Spike Lee,John David Washington,Adam Driver,Laura Harrier,Crime Drama History Comedy,blackkklansman,John David Washington Adam Driver Laura Harrier Spike Lee Crime Drama History Comedy
Sylvain White,Joey King,Julia Goldani Telles,Jaz Sinclair,Horror Mystery Thriller,slender man,Joey King Julia Goldani Telles Jaz Sinclair Sylvain White Horror Mystery Thriller
Jean-Stéphane Sauvaire,Joe Cole,unknown,unknown,Drama Action Crime,a prayer before dawn,Joe Cole unknown unknown Jean-Stéphane Sauvaire Drama Action Crime
Jon M. Chu,Constance Wu,Henry Golding,Gemma Chan,Comedy Drama Romance,crazy rich asians,Constance Wu Henry Golding Gemma Chan Jon M. Chu Comedy Drama Romance
Albert Hughes,Kodi Smit-McPhee,Leonor Varela,Jens Hultén,Adventure Drama,alpha,Kodi Smit-McPhee Leonor Varela Jens Hultén Albert Hughes Adventure Drama
Peter Berg,Mark Wahlberg,John Malkovich,Lauren Cohan,Action Thriller,mile 22,Mark Wahlberg John Malkovich Lauren Cohan Peter Berg Action Thriller
Björn Runge,Glenn Close,Jonathan Pryce,Christian Slater,Drama,the wife,Glenn Close Jonathan Pryce Christian Slater Björn Runge Drama
James Cox,Ansel Elgort,Taron Egerton,Kevin Spacey,Drama Thriller,billionaire boys club,Ansel Elgort Taron Egerton Kevin Spacey James Cox Drama Thriller
Jesse Peretz,Ethan Hawke,Rose Byrne,unknown,Comedy Drama Romance,"juliet, naked",Ethan Hawke Rose Byrne unknown Jesse Peretz Comedy Drama Romance
Rodrigo Cortés,AnnaSophia Robb,Uma Thurman,Isabelle Fuhrman,Thriller Drama Fantasy Horror,down a dark hall,AnnaSophia Robb Uma Thurman Isabelle Fuhrman Rodrigo Cortés Thriller Drama Fantasy Horror
Brian Henson,Melissa McCarthy,Maya Rudolph,Joel McHale,Action Comedy Crime,the happytime murders,Melissa McCarthy Maya Rudolph Joel McHale Brian Henson Action Comedy Crime
Aneesh Chaganty,John Cho,Debra Messing,unknown,Thriller Mystery Drama,searching,John Cho Debra Messing unknown Aneesh Chaganty Thriller Mystery Drama
Michael Noer,Charlie Hunnam,Rami Malek,unknown,Drama History Crime,papillon,Charlie Hunnam Rami Malek unknown Michael Noer Drama History Crime
Oliver Daly,Alex Neustaedter,Becky G,Alex MacNicoll,Science Fiction Action Adventure Family,a.x.l.,Alex Neustaedter Becky G Alex MacNicoll Oliver Daly Science Fiction Action Adventure Family
Chris Weitz,Oscar Isaac,Ben Kingsley,Lior Raz,Drama History Thriller,operation finale,Oscar Isaac Ben Kingsley Lior Raz Chris Weitz Drama History Thriller
"Jonathan Baker, Josh Baker",Myles Truitt,Jack Reynor,Zoë Kravitz,Science Fiction Action,kin,"Myles Truitt Jack Reynor Zoë Kravitz Jonathan Baker, Josh Baker Science Fiction Action"
Lenny Abrahamson,Domhnall Gleeson,Ruth Wilson,Will Poulter,Mystery Drama Horror History,the little stranger,Domhnall Gleeson Ruth Wilson Will Poulter Lenny Abrahamson Mystery Drama Horror History
Victor Levin,Winona Ryder,Keanu Reeves,unknown,Romance Comedy Drama,destination wedding,Winona Ryder Keanu Reeves unknown Victor Levin Romance Comedy Drama
Corin Hardy,Demián Bichir,Taissa Farmiga,Jonas Bloquet,Horror Mystery Thriller,the nun,Demián Bichir Taissa Farmiga Jonas Bloquet Corin Hardy Horror Mystery Thriller
Pierre Morel,Jennifer Garner,John Ortiz,Juan Pablo Raba,Action Thriller,peppermint,Jennifer Garner John Ortiz Juan Pablo Raba Pierre Morel Action Thriller
