director_name,actor_1_name,actor_2_name,actor_3_name,genres,movie_title,comb
Thomas Vinterberg,Carey Mulligan,Matthias Schoenaerts,Michael Sheen,Drama Romance,far from the madding crowd,Carey Mulligan Matthias Schoenaerts Michael Sheen Thomas Vinterberg Drama Romance
"Jarrad Paul, Andrew Mogel",Jack Black,James Marsden,Kathryn Hahn,Drama Comedy,the d train,"Jack Black James Marsden Kathryn Hahn Jarrad Paul, Andrew Mogel Drama Comedy"
Anne Fletcher,Reese Witherspoon,Sofía Vergara,John Carroll Lynch,Action Comedy Crime,hot pursuit,Reese Witherspoon Sofía Vergara John Carroll Lynch Anne Fletcher Action Comedy Crime
Henry Hobson,Arnold Schwarzenegger,Abigail Breslin,Joely Richardson,Horror Drama Mystery,maggie,Arnold Schwarzenegger Abigail Breslin Joely Richardson Henry Hobson Horror Drama Mystery
George Miller,Tom Hardy,Charlize Theron,Nicholas Hoult,Action Adventure Science Fiction,mad max: fury road,Tom Hardy Charlize Theron Nicholas Hoult George Miller Action Adventure Science Fiction
Elizabeth Banks,Anna Kendrick,Rebel Wilson,Hailee Steinfeld,Comedy Music,pitch perfect 2,Anna Kendrick Rebel Wilson Hailee Steinfeld Elizabeth Banks Comedy Music
Brett Haley,Blythe Danner,Martin Starr,June Squibb,Drama Comedy,i'll see you in my dreams,Blythe Danner Martin Starr June Squibb Brett Haley Drama Comedy
Gil Kenan,Sam Rockwell,Rosemarie DeWitt,Jared Harris,Horror Thriller,poltergeist,Sam Rockwell Rosemarie DeWitt Jared Harris Gil Kenan Horror Thriller
Brad Bird,George Clooney,Hugh Laurie,Britt Robertson,Adventure Family Mystery Science Fiction,tomorrowland,George Clooney Hugh Laurie Britt Robertson Brad Bird Adventure Family Mystery Science Fiction
Cameron Crowe,Bradley Cooper,Emma Stone,Rachel McAdams,Mystery Family Animation Adventure Comedy,aloha,Bradley Cooper Emma Stone Rachel McAdams Cameron Crowe Mystery Family Animation Adventure Comedy
Brad Peyton,Dwayne Johnson,Carla Gugino,Alexandra Daddario,Action Drama Thriller,san andreas,Dwayne Johnson Carla Gugino Alexandra Daddario Brad Peyton Action Drama Thriller
Kyle Newman,Hailee Steinfeld,Thomas Mann,Sophie Turner,Adventure Comedy Action Romance,barely lethal,Hailee Steinfeld Thomas Mann Sophie Turner Kyle Newman Adventure Comedy Action Romance
Safdie brothers,Arielle Holmes,Caleb Landry Jones,Buddy Duress,Drama Crime,heaven knows what,Arielle Holmes Caleb Landry Jones Buddy Duress Safdie brothers Drama Crime
"Paul Feig (director/(screenplay); Melissa McCarthy, Jason Statham, Rose Byrne, Miranda Hart, Bobby Cannavale, Allison Janney, Jude Law",Melissa McCarthy,Jason Statham,Rose Byrne,Action Comedy Family Adventure,spy,"Melissa McCarthy Jason Statham Rose Byrne Paul Feig (director/(screenplay); Melissa McCarthy, Jason Statham, Rose Byrne, Miranda Hart, Bobby Cannavale, Allison Janney, Jude Law Action Comedy Family Adventure"
Doug Ellin,Kevin Connolly,Adrian Grenier,Kevin Dillon,Comedy,entourage,Kevin Connolly Adrian Grenier Kevin Dillon Doug Ellin Comedy
Leigh Whannell,Dermot Mulroney,Stefanie Scott,Angus Sampson,Horror Drama Thriller,insidious: chapter 3,Dermot Mulroney Stefanie Scott Angus Sampson Leigh Whannell Horror Drama Thriller
Bill Pohlad,John Cusack,Paul Dano,Elizabeth Banks,Drama Music History,love & mercy,John Cusack Paul Dano Elizabeth Banks Bill Pohlad Drama Music History
Colin Trevorrow,Chris Pratt,Bryce Dallas Howard,Vincent D'Onofrio,Action Adventure Science Fiction Thriller,jurassic world,Chris Pratt Bryce Dallas Howard Vincent D'Onofrio Colin Trevorrow Action Adventure Science Fiction Thriller
Alfonso Gomez-Rejon,Thomas Mann,Olivia Cooke,RJ Cyler,Comedy Drama,me and earl and the dying girl,Thomas Mann Olivia Cooke RJ Cyler Alfonso Gomez-Rejon Comedy Drama
Rick Famuyiwa,Shameik Moore,Tony Revolori,Kiersey Clemons,Crime Drama Comedy,dope,Shameik Moore Tony Revolori Kiersey Clemons Rick Famuyiwa Crime Drama Comedy
Pete Docter,Amy Poehler,Phyllis Smith,Richard Kind,Animation Family Adventure Drama Comedy,inside out,Amy Poehler Phyllis Smith Richard Kind Pete Docter Animation Family Adventure Drama Comedy
Boaz Yakin,Josh Wiggins,Lauren Graham,Thomas Haden Church,Adventure Drama,max,Josh Wiggins Lauren Graham Thomas Haden Church Boaz Yakin Adventure Drama
Seth MacFarlane,Mark Wahlberg,Seth MacFarlane,Amanda Seyfried,Comedy,ted 2,Mark Wahlberg Seth MacFarlane Amanda Seyfried Seth MacFarlane Comedy
Alan Taylor,Arnold Schwarzenegger,Jason Clarke,Emilia Clarke,Science Fiction Action Thriller Adventure,terminator genisys,Arnold Schwarzenegger Jason Clarke Emilia Clarke Alan Taylor Science Fiction Action Thriller Adventure
Gregory Jacobs,Channing Tatum,Matt Bomer,Joe Manganiello,Comedy Drama,magic mike xxl,Channing Tatum Matt Bomer Joe Manganiello Gregory Jacobs Comedy Drama
Asif Kapadia,Asif Kapadia (director); Amy Winehouse,unknown,unknown,Documentary Music,amy,Asif Kapadia (director); Amy Winehouse unknown unknown Asif Kapadia Documentary Music
"Pierre Coffin, Kyle Balda",Pierre Coffin,Sandra Bullock,Jon Hamm,Family Animation Adventure Comedy,minions,"Pierre Coffin Sandra Bullock Jon Hamm Pierre Coffin, Kyle Balda Family Animation Adventure Comedy"
"Chris Lofing, Travis Cluff",Reese Mishler,Pfeifer Brown,Ryan Shoos,Horror Thriller,the gallows,"Reese Mishler Pfeifer Brown Ryan Shoos Chris Lofing, Travis Cluff Horror Thriller"
Tarsem Singh,Ryan Reynolds,Natalie Martinez,Matthew Goode,Science Fiction Mystery Thriller,self/less,Ryan Reynolds Natalie Martinez Matthew Goode Tarsem Singh Science Fiction Mystery Thriller
Sean Baker,Kitana Kiki Rodriguez,Mya Taylor,Karren Karagulian,Comedy Drama,tangerine,Kitana Kiki Rodriguez Mya Taylor Karren Karagulian Sean Baker Comedy Drama
Dito Montiel,Robin Williams,Kathy Baker,Roberto Aguire,Drama,boulevard,Robin Williams Kathy Baker Roberto Aguire Dito Montiel Drama
Kim Farrant,Nicole Kidman,Joseph Fiennes,Hugo Weaving,Drama Thriller Mystery,strangerland,Nicole Kidman Joseph Fiennes Hugo Weaving Kim Farrant Drama Thriller Mystery
Peyton Reed,Paul Rudd,Evangeline Lilly,Corey Stoll,Science Fiction Action Adventure,ant-man,Paul Rudd Evangeline Lilly Corey Stoll Peyton Reed Science Fiction Action Adventure
Judd Apatow,Amy Schumer,Bill Hader,Brie Larson,Comedy Romance,trainwreck,Amy Schumer Bill Hader Brie Larson Judd Apatow Comedy Romance
Woody Allen,Jamie Blackley,Joaquin Phoenix,Parker Posey,Drama Comedy Crime,irrational man,Jamie Blackley Joaquin Phoenix Parker Posey Woody Allen Drama Comedy Crime
Bill Condon,Ian McKellen,Laura Linney,Hiroyuki Sanada,Drama Mystery,mr. holmes,Ian McKellen Laura Linney Hiroyuki Sanada Bill Condon Drama Mystery
Chris Columbus,Michael Douglas,Diane Keaton,Sterling Jerins,Action Comedy Science Fiction,pixels,Michael Douglas Diane Keaton Sterling Jerins Chris Columbus Action Comedy Science Fiction
Antoine Fuqua,Jake Gyllenhaal,Forest Whitaker,Naomie Harris,Action Drama,southpaw,Jake Gyllenhaal Forest Whitaker Naomie Harris Antoine Fuqua Action Drama
Jake Schreier,Nat Wolff,Cara Delevingne,Halston Sage,Mystery Drama Romance,paper towns,Nat Wolff Cara Delevingne Halston Sage Jake Schreier Mystery Drama Romance
Mark Neveldine,Olivia Taylor Dudley,Michael Peña,Dougray Scott,Thriller Horror,the vatican tapes,Olivia Taylor Dudley Michael Peña Dougray Scott Mark Neveldine Thriller Horror
"Jonathan Goldstein, John Francis Daley",Ed Helms,Christina Applegate,Leslie Mann,Comedy,vacation,"Ed Helms Christina Applegate Leslie Mann Jonathan Goldstein, John Francis Daley Comedy"
Christopher McQuarrie,Tom Cruise,Jeremy Renner,Simon Pegg,Action Adventure,mission impossible: rogue nation,Tom Cruise Jeremy Renner Simon Pegg Christopher McQuarrie Action Adventure
Joel Edgerton,Jason Bateman,Rebecca Hall,Joel Edgerton,Thriller Mystery Drama Horror,the gift,Jason Bateman Rebecca Hall Joel Edgerton Joel Edgerton Thriller Mystery Drama Horror
Jonathan Demme,Meryl Streep,Kevin Kline,Mamie Gummer,Comedy Drama Music,ricki and the flash,Meryl Streep Kevin Kline Mamie Gummer Jonathan Demme Comedy Drama Music
F. Gary Gray,O'Shea Jackson Jr.,Corey Hawkins,Jason Mitchell,Drama Music,straight outta compton,O'Shea Jackson Jr. Corey Hawkins Jason Mitchell F. Gary Gray Drama Music
Guy Ritchie,Henry Cavill,Armie Hammer,Alicia Vikander,Comedy Action Adventure,the man from u.n.c.l.e.,Henry Cavill Armie Hammer Alicia Vikander Guy Ritchie Comedy Action Adventure
Peter Bogdanovich,Owen Wilson,Imogen Poots,Kathryn Hahn,Comedy Romance,she's funny that way,Owen Wilson Imogen Poots Kathryn Hahn Peter Bogdanovich Comedy Romance
John Erick Dowdle,Owen Wilson,Lake Bell,Sterling Jerins,Thriller,no escape,Owen Wilson Lake Bell Sterling Jerins John Erick Dowdle Thriller
Aleksander Bach,Rupert Friend,Hannah Ware,Zachary Quinto,Action Crime Thriller,hitman: agent 47,Rupert Friend Hannah Ware Zachary Quinto Aleksander Bach Action Crime Thriller
Chris Evans,Chris Evans,Alice Eve,unknown,Drama Romance Comedy,before we go,Chris Evans Alice Eve unknown Chris Evans Drama Romance Comedy
M. Night Shyamalan,Olivia DeJonge,Ed Oxenbould,Deanna Dunagan,Horror Thriller Mystery,the visit,Olivia DeJonge Ed Oxenbould Deanna Dunagan M. Night Shyamalan Horror Thriller Mystery
David M. Rosenthal,Sanaa Lathan,Michael Ealy,Morris Chestnut,Thriller,the perfect guy,Sanaa Lathan Michael Ealy Morris Chestnut David M. Rosenthal Thriller
Leslye Headland,Jason Sudeikis,Alison Brie,Adam Scott,Comedy,sleeping with other people,Jason Sudeikis Alison Brie Adam Scott Leslye Headland Comedy
Scott Cooper,Johnny Depp,Joel Edgerton,Benedict Cumberbatch,Drama Crime History,black mass,Johnny Depp Joel Edgerton Benedict Cumberbatch Scott Cooper Drama Crime History
Baltasar Kormákur,Jason Clarke,Josh Brolin,John Hawkes,Drama Adventure History,everest,Jason Clarke Josh Brolin John Hawkes Baltasar Kormákur Drama Adventure History
Denis Villeneuve,Emily Blunt,Benicio del Toro,Josh Brolin,Action Crime Thriller,sicario,Emily Blunt Benicio del Toro Josh Brolin Denis Villeneuve Action Crime Thriller
Ryan Little,Luke Goss,Dolph Lundgren,Chuck Liddell,War Action,war pigs,Luke Goss Dolph Lundgren Chuck Liddell Ryan Little War Action
Genndy Tartakovsky,Adam Sandler,Andy Samberg,Selena Gomez,Family Animation Comedy Fantasy,hotel transylvania 2,Adam Sandler Andy Samberg Selena Gomez Genndy Tartakovsky Family Animation Comedy Fantasy
Ramin Bahrani,Andrew Garfield,Michael Shannon,Tim Guinee,Drama,99 homes,Andrew Garfield Michael Shannon Tim Guinee Ramin Bahrani Drama
Nancy Meyers,Robert De Niro,Anne Hathaway,Rene Russo,Comedy,the intern,Robert De Niro Anne Hathaway Rene Russo Nancy Meyers Comedy
Roland Emmerich,Jeremy Irvine,Jonny Beauchamp,Joey King,Drama History,stonewall,Jeremy Irvine Jonny Beauchamp Joey King Roland Emmerich Drama History
"Anna Boden, Ryan Fleck",Ryan Reynolds,Ben Mendelsohn,Sienna Miller,Drama Thriller,mississippi grind,"Ryan Reynolds Ben Mendelsohn Sienna Miller Anna Boden, Ryan Fleck Drama Thriller"
Robert Zemeckis,Joseph Gordon-Levitt,Ben Kingsley,Charlotte Le Bon,Adventure Drama Thriller,the walk,Joseph Gordon-Levitt Ben Kingsley Charlotte Le Bon Robert Zemeckis Adventure Drama Thriller
Ridley Scott,Matt Damon,Jessica Chastain,Kristen Wiig,Drama Adventure Science Fiction,the martian,Matt Damon Jessica Chastain Kristen Wiig Ridley Scott Drama Adventure Science Fiction
Danny Boyle,Michael Fassbender,Kate Winslet,Seth Rogen,Drama History,steve jobs,Michael Fassbender Kate Winslet Seth Rogen Danny Boyle Drama History
Joe Wright,Hugh Jackman,Garrett Hedlund,Rooney Mara,Animation Family Adventure Fantasy,pan,Hugh Jackman Garrett Hedlund Rooney Mara Joe Wright Animation Family Adventure Fantasy
Eli Roth,Keanu Reeves,Ana de Armas,Lorenza Izzo,Drama Thriller Horror,knock knock,Keanu Reeves Ana de Armas Lorenza Izzo Eli Roth Drama Thriller Horror
Cary Joji Fukunaga,Idris Elba,Kurt Egyiawan,Jude Akuwudike,Drama War,beasts of no nation,Idris Elba Kurt Egyiawan Jude Akuwudike Cary Joji Fukunaga Drama War
Steven Spielberg,Tom Hanks,Mark Rylance,Amy Ryan,Thriller Drama,bridge of spies,Tom Hanks Mark Rylance Amy Ryan Steven Spielberg Thriller Drama
Guillermo del Toro,Mia Wasikowska,Jessica Chastain,Tom Hiddleston,Horror Thriller Romance Mystery,crimson peak,Mia Wasikowska Jessica Chastain Tom Hiddleston Guillermo del Toro Horror Thriller Romance Mystery
Rob Letterman,Jack Black,Dylan Minnette,Odeya Rush,Adventure Horror Comedy,goosebumps,Jack Black Dylan Minnette Odeya Rush Rob Letterman Adventure Horror Comedy
Lenny Abrahamson,Brie Larson,Jacob Tremblay,Joan Allen,Thriller Action Mystery Horror,room,Brie Larson Jacob Tremblay Joan Allen Lenny Abrahamson Thriller Action Mystery Horror
Andrew Erwin,Sean Astin,Nic Bishop,Caleb Castille,Drama,woodlawn,Sean Astin Nic Bishop Caleb Castille Andrew Erwin Drama
James Vanderbilt,Cate Blanchett,Robert Redford,Topher Grace,Thriller Horror,truth,Cate Blanchett Robert Redford Topher Grace James Vanderbilt Thriller Horror
Michael Almereyda,Peter Sarsgaard,Winona Ryder,Jim Gaffigan,Drama History,experimenter,Peter Sarsgaard Winona Ryder Jim Gaffigan Michael Almereyda Drama History
Barry Levinson,Bill Murray,Kate Hudson,Zooey Deschanel,Comedy Music War,rock the kasbah,Bill Murray Kate Hudson Zooey Deschanel Barry Levinson Comedy Music War
Gregory Plotkin,Chris J. Murray,Brittany Shaw,Dan Gill,Horror Thriller,paranormal activity: the ghost dimension,Chris J. Murray Brittany Shaw Dan Gill Gregory Plotkin Horror Thriller
Jon M. Chu,Aubrey Peeples,Stefanie Scott,Hayley Kiyoko,Fantasy Music Family,jem and the holograms,Aubrey Peeples Stefanie Scott Hayley Kiyoko Jon M. Chu Fantasy Music Family
Breck Eisner,Vin Diesel,Elijah Wood,Rose Leslie,Fantasy Action Adventure Science Fiction,the last witch hunter,Vin Diesel Elijah Wood Rose Leslie Breck Eisner Fantasy Action Adventure Science Fiction
Sarah Gavron,Carey Mulligan,Helena Bonham Carter,Brendan Gleeson,Drama History,suffragette,Carey Mulligan Helena Bonham Carter Brendan Gleeson Sarah Gavron Drama History
S. Craig Zahler,Kurt Russell,Patrick Wilson,Matthew Fox,Western Horror,bone tomahawk,Kurt Russell Patrick Wilson Matthew Fox S. Craig Zahler Western Horror
Adam Salky,Sarah Silverman,Josh Charles,Thomas Sadoski,Drama,i smile back,Sarah Silverman Josh Charles Thomas Sadoski Adam Salky Drama
Christopher Landon,Tye Sheridan,David Koechner,unknown,Comedy Horror,scouts guide to the zombie apocalypse,Tye Sheridan David Koechner unknown Christopher Landon Comedy Horror
David Gordon Green,Sandra Bullock,Billy Bob Thornton,Anthony Mackie,Comedy Drama,our brand is crisis,Sandra Bullock Billy Bob Thornton Anthony Mackie David Gordon Green Comedy Drama
John Wells,Bradley Cooper,Sienna Miller,Omar Sy,Drama,burnt,Bradley Cooper Sienna Miller Omar Sy John Wells Drama
John Crowley,Saoirse Ronan,Emory Cohen,Domhnall Gleeson,Drama Thriller,brooklyn,Saoirse Ronan Emory Cohen Domhnall Gleeson John Crowley Drama Thriller
Sam Mendes,Daniel Craig,Christoph Waltz,Léa Seydoux,Action Adventure Thriller,spectre,Daniel Craig Christoph Waltz Léa Seydoux Sam Mendes Action Adventure Thriller
Tom McCarthy,Mark Ruffalo,Michael Keaton,Rachel McAdams,Drama Thriller History,spotlight,Mark Ruffalo Michael Keaton Rachel McAdams Tom McCarthy Drama Thriller History
Steve Martino,Noah Schnapp,Hadley Belle Miller,Mariel Sheets,Adventure Comedy Animation Family,the peanuts movie,Noah Schnapp Hadley Belle Miller Mariel Sheets Steve Martino Adventure Comedy Animation Family
Patricia Riggen,Antonio Banderas,Rodrigo Santoro,Juliette Binoche,Drama History,the 33,Antonio Banderas Rodrigo Santoro Juliette Binoche Patricia Riggen Drama History
Angelo Pizzo,Aaron Eckhart,Finn Wittrock,Robin Tunney,Drama,my all american,Aaron Eckhart Finn Wittrock Robin Tunney Angelo Pizzo Drama
Angelina Jolie,Brad Pitt,Angelina Jolie,unknown,Drama,by the sea,Brad Pitt Angelina Jolie unknown Angelina Jolie Drama
Todd Haynes,Cate Blanchett,Rooney Mara,Sarah Paulson,Romance Drama,carol,Cate Blanchett Rooney Mara Sarah Paulson Todd Haynes Romance Drama
Francis Lawrence,Jennifer Lawrence,Josh Hutcherson,Liam Hemsworth,Action Adventure Science Fiction,the hunger games: mockingjay – part 2,Jennifer Lawrence Josh Hutcherson Liam Hemsworth Francis Lawrence Action Adventure Science Fiction
Ryan Coogler,Michael B. Jordan,Sylvester Stallone,Tessa Thompson,Drama,creed,Michael B. Jordan Sylvester Stallone Tessa Thompson Ryan Coogler Drama
Peter Sohn,Raymond Ochoa,Jack Bright,Steve Zahn,Adventure Animation Family,the good dinosaur,Raymond Ochoa Jack Bright Steve Zahn Peter Sohn Adventure Animation Family
Paul McGuigan,Daniel Radcliffe,James McAvoy,Jessica Brown Findlay,Drama Science Fiction Thriller,victor frankenstein,Daniel Radcliffe James McAvoy Jessica Brown Findlay Paul McGuigan Drama Science Fiction Thriller
Michael Dougherty,Adam Scott,Toni Collette,David Koechner,Horror Comedy Fantasy,krampus,Adam Scott Toni Collette David Koechner Michael Dougherty Horror Comedy Fantasy
Ron Howard,Chris Hemsworth,Benjamin Walker,Cillian Murphy,Thriller Drama Adventure Action History,in the heart of the sea,Chris Hemsworth Benjamin Walker Cillian Murphy Ron Howard Thriller Drama Adventure Action History
Adam McKay,Christian Bale,Steve Carell,Ryan Gosling,Comedy Drama,the big short,Christian Bale Steve Carell Ryan Gosling Adam McKay Comedy Drama
J. J. Abrams,Harrison Ford,Mark Hamill,Carrie Fisher,Action Adventure Science Fiction Fantasy,star wars: the force awakens,Harrison Ford Mark Hamill Carrie Fisher J. J. Abrams Action Adventure Science Fiction Fantasy
Peter Landesman,Will Smith,Alec Baldwin,Gugu Mbatha-Raw,Drama,concussion,Will Smith Alec Baldwin Gugu Mbatha-Raw Peter Landesman Drama
Sean Anders,Will Ferrell,Mark Wahlberg,Linda Cardellini,Comedy,daddy's home,Will Ferrell Mark Wahlberg Linda Cardellini Sean Anders Comedy
David O. Russell,Jennifer Lawrence,Robert De Niro,Édgar Ramírez,Mystery Thriller Drama,joy,Jennifer Lawrence Robert De Niro Édgar Ramírez David O. Russell Mystery Thriller Drama
Ericson Core,Édgar Ramírez,Luke Bracey,Teresa Palmer,Action Crime Thriller,point break,Édgar Ramírez Luke Bracey Teresa Palmer Ericson Core Action Crime Thriller
Quentin Tarantino,Samuel L. Jackson,Kurt Russell,Jennifer Jason Leigh,Crime Drama Mystery Western,the hateful eight,Samuel L. Jackson Kurt Russell Jennifer Jason Leigh Quentin Tarantino Crime Drama Mystery Western
Alejandro G. Iñárritu,Leonardo DiCaprio,Tom Hardy,unknown,Western Drama Adventure,the revenant,Leonardo DiCaprio Tom Hardy unknown Alejandro G. Iñárritu Western Drama Adventure
Jason Zada,Jason Zada (director); Natalie Dormer,Taylor Kitsch,unknown,Horror Thriller Mystery,the forest,Jason Zada (director); Natalie Dormer Taylor Kitsch unknown Jason Zada Horror Thriller Mystery
Tim Blake Nelson,Tim Blake Nelson (director); Sam Waterston,Tim Blake Nelson,Kristen Stewart,Drama Thriller,anesthesia,Tim Blake Nelson (director); Sam Waterston Tim Blake Nelson Kristen Stewart Tim Blake Nelson Drama Thriller
Ross Partridge,Ross Partridge (director); Ross Partridge,Oona Laurence,Jess Weixler,Horror Drama Thriller,lamb,Ross Partridge (director); Ross Partridge Oona Laurence Jess Weixler Ross Partridge Horror Drama Thriller
Tim Story,Tim Story (director); Ice Cube,Kevin Hart,unknown,Action Comedy,ride along 2,Tim Story (director); Ice Cube Kevin Hart unknown Tim Story Action Comedy
Michael Bay,Michael Bay (director); James Badge Dale,John Krasinski,Max Martini,War Action History Thriller Drama,13 hours: the secret soldiers of benghazi,Michael Bay (director); James Badge Dale John Krasinski Max Martini Michael Bay War Action History Thriller Drama
Trevor Wall,Trevor Wall (director); Rob Schneider,Heather Graham,Ken Jeong,Adventure Animation Comedy Family,norm of the north,Trevor Wall (director); Rob Schneider Heather Graham Ken Jeong Trevor Wall Adventure Animation Comedy Family
Andrew Renzi,Andrew Renzi (director); Richard Gere,Dakota Fanning,Theo James,Drama,the benefactor,Andrew Renzi (director); Richard Gere Dakota Fanning Theo James Andrew Renzi Drama
Dan Mazer,Dan Mazer (director); Zac Efron,Robert De Niro,Aubrey Plaza,Comedy,dirty grandpa,Dan Mazer (director); Zac Efron Robert De Niro Aubrey Plaza Dan Mazer Comedy
J Blakeson,J Blakeson (director); Chloë Grace Moretz,Nick Robinson,Maria Bello,Science Fiction Adventure Action,the 5th wave,J Blakeson (director); Chloë Grace Moretz Nick Robinson Maria Bello J Blakeson Science Fiction Adventure Action
William Brent Bell,William Brent Bell (director); Lauren Cohan,Rupert Evans,unknown,Horror Thriller Mystery,the boy,William Brent Bell (director); Lauren Cohan Rupert Evans unknown William Brent Bell Horror Thriller Mystery
Jacob Gentry,Jacob Gentry (director); Brianne Davis,Chad McKnight,Scott Poythress,Thriller Mystery Science Fiction,synchronicity,Jacob Gentry (director); Brianne Davis Chad McKnight Scott Poythress Jacob Gentry Thriller Mystery Science Fiction
"Jennifer Yuh Nelson, Alessandro Carloni",Jennifer Yuh Nelson,Alessandro Carloni (directors); Jack Black,Bryan Cranston,Action Adventure Animation Comedy Family,kung fu panda 3,"Jennifer Yuh Nelson Alessandro Carloni (directors); Jack Black Bryan Cranston Jennifer Yuh Nelson, Alessandro Carloni Action Adventure Animation Comedy Family"
Craig Gillespie,Craig Gillespie (director); Chris Pine,Casey Affleck,Ben Foster,Action Drama History Thriller,the finest hours,Craig Gillespie (director); Chris Pine Casey Affleck Ben Foster Craig Gillespie Action Drama History Thriller
Michael Tiddes,Michael Tiddes (director); Marlon Wayans,Kali Hawk,Mike Epps,Romance Comedy,fifty shades of black,Michael Tiddes (director); Marlon Wayans Kali Hawk Mike Epps Michael Tiddes Romance Comedy
Gavin O'Connor,Gavin O'Connor (director); Natalie Portman,Joel Edgerton,Noah Emmerich,Western Action Drama,jane got a gun,Gavin O'Connor (director); Natalie Portman Joel Edgerton Noah Emmerich Gavin O'Connor Western Action Drama
"Joel Coen, Ethan Coen",Josh Brolin,George Clooney,Alden Ehrenreich,Comedy Drama Mystery,"hail, caesar!","Josh Brolin George Clooney Alden Ehrenreich Joel Coen, Ethan Coen Comedy Drama Mystery"
Burr Steers,Burr Steers (director); Lily James,Sam Riley,Jack Huston,Romance Horror Comedy Thriller,pride + prejudice + zombies,Burr Steers (director); Lily James Sam Riley Jack Huston Burr Steers Romance Horror Comedy Thriller
Ross Katz,Ross Katz (director); Benjamin Walker,Teresa Palmer,Maggie Grace,Drama Romance,the choice,Ross Katz (director); Benjamin Walker Teresa Palmer Maggie Grace Ross Katz Drama Romance
Tim Miller,Tim Miller (director); Ryan Reynolds,Morena Baccarin,Ed Skrein,Action Adventure Comedy,deadpool,Tim Miller (director); Ryan Reynolds Morena Baccarin Ed Skrein Tim Miller Action Adventure Comedy
Ben Stiller,Ben Stiller (director); Ben Stiller,Owen Wilson,Will Ferrell,Comedy,zoolander 2,Ben Stiller (director); Ben Stiller Owen Wilson Will Ferrell Ben Stiller Comedy
Christian Ditter,Christian Ditter (director); Dakota Johnson,Rebel Wilson,Alison Brie,Comedy Romance,how to be single,Christian Ditter (director); Dakota Johnson Rebel Wilson Alison Brie Christian Ditter Comedy Romance
Kevin Reynolds,Kevin Reynolds (director); Joseph Fiennes,Tom Felton,Peter Firth,Drama History,risen,Kevin Reynolds (director); Joseph Fiennes Tom Felton Peter Firth Kevin Reynolds Drama History
Robert Eggers,Anya Taylor-Joy,Ralph Ineson,Kate Dickie,Horror,the witch,Anya Taylor-Joy Ralph Ineson Kate Dickie Robert Eggers Horror
Stephen Hopkins,Stephen Hopkins (director); Stephan James,Jason Sudeikis,Jeremy Irons,Action Thriller Science Fiction,race,Stephen Hopkins (director); Stephan James Jason Sudeikis Jeremy Irons Stephen Hopkins Action Thriller Science Fiction
Yuen Woo-ping,Yuen Woo-ping (director); Donnie Yen,Michelle Yeoh,Harry Shum Jr.,Action Adventure Drama,"crouching tiger, hidden dragon: sword of destiny",Yuen Woo-ping (director); Donnie Yen Michelle Yeoh Harry Shum Jr. Yuen Woo-ping Action Adventure Drama
Alex Proyas,Alex Proyas (director); Nicolaj Coster-Waldau,Gerard Butler,Brenton Thwaites,Action Adventure Fantasy,gods of egypt,Alex Proyas (director); Nicolaj Coster-Waldau Gerard Butler Brenton Thwaites Alex Proyas Action Adventure Fantasy
John Hillcoat,John Hillcoat (director); Casey Affleck,Chiwetel Ejiofor,Anthony Mackie,Action Thriller Mystery,triple 9,John Hillcoat (director); Casey Affleck Chiwetel Ejiofor Anthony Mackie John Hillcoat Action Thriller Mystery
Dexter Fletcher,Dexter Fletcher (director); Taron Egerton,Hugh Jackman,Christopher Walken,Comedy Drama History Adventure,eddie the eagle,Dexter Fletcher (director); Taron Egerton Hugh Jackman Christopher Walken Dexter Fletcher Comedy Drama History Adventure
"Byron Howard, Rich Moore",Byron Howard,Rich Moore (directors); Ginnifer Goodwin,Jason Bateman,Animation Adventure Family Comedy,zootopia,"Byron Howard Rich Moore (directors); Ginnifer Goodwin Jason Bateman Byron Howard, Rich Moore Animation Adventure Family Comedy"
Babak Najafi,Babak Najafi (director); Gerard Butler,Aaron Eckhart,Morgan Freeman,Action Thriller,london has fallen,Babak Najafi (director); Gerard Butler Aaron Eckhart Morgan Freeman Babak Najafi Action Thriller
"Glenn Ficarra, John Requa",Glenn Ficarra,John Requa (directors); Tina Fey,Margot Robbie,Comedy Drama War,whiskey tango foxtrot,"Glenn Ficarra John Requa (directors); Tina Fey Margot Robbie Glenn Ficarra, John Requa Comedy Drama War"
Johannes Roberts,Johannes Roberts (director); Sarah Wayne Callies,Jeremy Sisto,unknown,Thriller Horror,the other side of the door,Johannes Roberts (director); Sarah Wayne Callies Jeremy Sisto unknown Johannes Roberts Thriller Horror
Dan Trachtenberg,John Goodman,Mary Elizabeth Winstead,John Gallagher Jr.,Thriller Science Fiction Drama Horror,10 cloverfield lane,John Goodman Mary Elizabeth Winstead John Gallagher Jr. Dan Trachtenberg Thriller Science Fiction Drama Horror
