director_name,actor_1_name,actor_2_name,actor_3_name,genres,movie_title,comb
Timur Bekmambetov,Benjamin Walker,Dominic Cooper,Anthony Mackie,Action Fantasy Horror,abraham lincoln: vampire hunter,Benjamin Walker Dominic Cooper Anthony Mackie Timur Bekmambetov Action Fantasy Horror
"Mark Andrews, Brenda Chapman, Steve Purcell",Kelly Macdonald,Julie Walters,Billy Connolly,Animation Adventure Comedy Family Action Fantasy,brave,"Kelly Macdonald Julie Walters Billy Connolly Mark Andrews, Brenda Chapman, Steve Purcell Animation Adventure Comedy Family Action Fantasy"
Lorene Scafaria,Steve Carell,Keira Knightley,Connie Britton,Comedy Drama Romance Science Fiction,seeking a friend for the end of the world,Steve Carell Keira Knightley Connie Britton Lorene Scafaria Comedy Drama Romance Science Fiction
Kirby Dick,Kirby Dick (director/screenplay);,unknown,unknown,Crime Drama History Documentary,the invisible war,Kirby Dick (director/screenplay); unknown unknown Kirby Dick Crime Drama History Documentary
Woody Allen,Alec Baldwin,Roberto Benigni,Penélope Cruz,Romance Comedy Drama,to rome with love ₪,Alec Baldwin Roberto Benigni Penélope Cruz Woody Allen Romance Comedy Drama
Benh Zeitlin,Quvenzhané Wallis,Dwight Henry,unknown,Drama,beasts of the southern wild,Quvenzhané Wallis Dwight Henry unknown Benh Zeitlin Drama
Tyler Perry,Tyler Perry,Eugene Levy,Doris Roberts,Drama Comedy Crime,madea's witness protection,Tyler Perry Eugene Levy Doris Roberts Tyler Perry Drama Comedy Crime
Steven Soderbergh,Channing Tatum,Alex Pettyfer,Matthew McConaughey,Comedy Drama,magic mike,Channing Tatum Alex Pettyfer Matthew McConaughey Steven Soderbergh Comedy Drama
Alex Kurtzman,Chris Pine,Elizabeth Banks,Michelle Pfeiffer,Drama,people like us,Chris Pine Elizabeth Banks Michelle Pfeiffer Alex Kurtzman Drama
Seth MacFarlane,Mark Wahlberg,Mila Kunis,Seth MacFarlane,Comedy Fantasy,ted,Mark Wahlberg Mila Kunis Seth MacFarlane Seth MacFarlane Comedy Fantasy
Philippe Garrel,Philippe Garrel (director); Monica Bellucci,Louis Garrel,Céline Sallette,Drama,a burning hot summer,Philippe Garrel (director); Monica Bellucci Louis Garrel Céline Sallette Philippe Garrel Drama
Glendyn Ivin,Hugo Weaving,Tom Russell,unknown,Drama,last ride,Hugo Weaving Tom Russell unknown Glendyn Ivin Drama
Jonathan Demme,Jonathan Demme (director); Neil Young,unknown,unknown,Music Documentary,neil young journeys,Jonathan Demme (director); Neil Young unknown unknown Jonathan Demme Music Documentary
Sarah Polley,Seth Rogen,Michelle Williams,Sarah Silverman,Drama Comedy,take this waltz,Seth Rogen Michelle Williams Sarah Silverman Sarah Polley Drama Comedy
André Téchiné,André Téchiné (director); André Dussollier,Carole Bouquet,Adriana Asti,Drama,unforgivable,André Téchiné (director); André Dussollier Carole Bouquet Adriana Asti André Téchiné Drama
Marc Webb,Andrew Garfield,Emma Stone,Max Charles,Action Adventure Fantasy,the amazing spider-man,Andrew Garfield Emma Stone Max Charles Marc Webb Action Adventure Fantasy
Oliver Stone,Taylor Kitsch,Blake Lively,Aaron Johnson,Crime Drama Thriller,savages,Taylor Kitsch Blake Lively Aaron Johnson Oliver Stone Crime Drama Thriller
Martin Donovan,Martin Donovan,David Morse,Olivia Williams,Comedy Drama,collaborator,Martin Donovan David Morse Olivia Williams Martin Donovan Comedy Drama
"Steve Martino, Mike Thurmeier",Ray Romano,John Leguizamo,Denis Leary,Animation Comedy Adventure Family,ice age: continental drift,"Ray Romano John Leguizamo Denis Leary Steve Martino, Mike Thurmeier Animation Comedy Adventure Family"
Benoît Jacquot,Léa Seydoux,Diane Kruger,Virginie Ledoyen,Drama History,"farewell, my queen",Léa Seydoux Diane Kruger Virginie Ledoyen Benoît Jacquot Drama History
Bart Layton,Bart Layton (director); Frédéric Bourdin,unknown,unknown,Documentary Mystery,the imposter,Bart Layton (director); Frédéric Bourdin unknown unknown Bart Layton Documentary Mystery
Nancy Savoca,Mira Sorvino,Tammy Blanchard,Patti LuPone,Drama,union square,Mira Sorvino Tammy Blanchard Patti LuPone Nancy Savoca Drama
"Will Lovelace, Dylan Southern",Will Lovelace,Dylan Southern (directors); James Murphy,Nancy Whang,Music Documentary,shut up and play the hits,"Will Lovelace Dylan Southern (directors); James Murphy Nancy Whang Will Lovelace, Dylan Southern Music Documentary"
Christopher Nolan,Christian Bale,Michael Caine,Gary Oldman,Action Crime Drama Thriller,the dark knight rises,Christian Bale Michael Caine Gary Oldman Christopher Nolan Action Crime Drama Thriller
Lauren Greenfield,Lauren Greenfield (director); David A. Siegel,Jackie Siegel,unknown,Documentary,the queen of versailles,Lauren Greenfield (director); David A. Siegel Jackie Siegel unknown Lauren Greenfield Documentary
Timo Vuorensola,Julia Dietze,Peta Sergeant,Götz Otto,Action Comedy Science Fiction,iron sky,Julia Dietze Peta Sergeant Götz Otto Timo Vuorensola Action Comedy Science Fiction
"Jonathan Dayton, Valerie Faris",Paul Dano,Zoe Kazan,Annette Bening,Comedy Romance Fantasy Drama,ruby sparks,"Paul Dano Zoe Kazan Annette Bening Jonathan Dayton, Valerie Faris Comedy Romance Fantasy Drama"
Scott Speer,Ryan Guzman,Kathryn McCormick,Misha Gabriel,Music Drama Romance,step up revolution,Ryan Guzman Kathryn McCormick Misha Gabriel Scott Speer Music Drama Romance
Akiva Schaffer,Ben Stiller,Vince Vaughn,Rosemarie DeWitt,Comedy Action Science Fiction Mystery,the watch,Ben Stiller Vince Vaughn Rosemarie DeWitt Akiva Schaffer Comedy Action Science Fiction Mystery
Alison Klayman,Danqing Chen,Ying Gao,Changwei Gu,Documentary,ai weiwei: never sorry,Danqing Chen Ying Gao Changwei Gu Alison Klayman Documentary
William Friedkin,Matthew McConaughey,Emile Hirsch,Juno Temple,Crime Thriller Drama,killer joe,Matthew McConaughey Emile Hirsch Juno Temple William Friedkin Crime Thriller Drama
Malik Bendjelloul,Malik Bendjelloul (director); Rodriguez,unknown,unknown,Music Documentary,searching for sugar man,Malik Bendjelloul (director); Rodriguez unknown unknown Malik Bendjelloul Music Documentary
David Bowers,Zachary Gordon,Robert Capron,Rachael Harris,Comedy Family,diary of a wimpy kid: dog days,Zachary Gordon Robert Capron Rachael Harris David Bowers Comedy Family
Len Wiseman,Colin Farrell,Jessica Biel,Bryan Cranston,Action Science Fiction Adventure Thriller,total recall,Colin Farrell Jessica Biel Bryan Cranston Len Wiseman Action Science Fiction Adventure Thriller
Fernando Meirelles,Rachel Weisz,Anthony Hopkins,Jude Law,Drama Romance,360,Rachel Weisz Anthony Hopkins Jude Law Fernando Meirelles Drama Romance
Lee Toland Krieger,Rashida Jones,Andy Samberg,Elijah Wood,Comedy Drama Romance,celeste and jesse forever,Rashida Jones Andy Samberg Elijah Wood Lee Toland Krieger Comedy Drama Romance
David Frankel,Meryl Streep,Tommy Lee Jones,Steve Carell,Drama Comedy Romance,hope springs,Meryl Streep Tommy Lee Jones Steve Carell David Frankel Drama Comedy Romance
Tony Gilroy,Jeremy Renner,Rachel Weisz,Edward Norton,Action Thriller,the bourne legacy,Jeremy Renner Rachel Weisz Edward Norton Tony Gilroy Action Thriller
Jay Roach,Will Ferrell,Zach Galifianakis,Jason Sudeikis,Comedy,the campaign,Will Ferrell Zach Galifianakis Jason Sudeikis Jay Roach Comedy
Julie Delpy,Julie Delpy,Chris Rock,Albert Delpy,Comedy Drama Romance,2 days in new york,Julie Delpy Chris Rock Albert Delpy Julie Delpy Comedy Drama Romance
Peter Hedges,Jennifer Garner,Joel Edgerton,C.J. Adams,Fantasy Drama Comedy Family,the odd life of timothy green,Jennifer Garner Joel Edgerton C.J. Adams Peter Hedges Fantasy Drama Comedy Family
Kabir Khan,Salman Khan,Katrina Kaif,unknown,Action Romance Thriller,ek tha tiger,Salman Khan Katrina Kaif unknown Kabir Khan Action Romance Thriller
Simon West,Sylvester Stallone,Jason Statham,Jet Li,Action Adventure Thriller,the expendables 2,Sylvester Stallone Jason Statham Jet Li Simon West Action Adventure Thriller
Chris Butler (director/screenplay); Sam Fell,Sam Fell (director); Kodi Smit-McPhee,Tucker Albrizzi,Anna Kendrick,Family Animation Adventure Comedy,paranorman,Sam Fell (director); Kodi Smit-McPhee Tucker Albrizzi Anna Kendrick Chris Butler (director/screenplay); Sam Fell Family Animation Adventure Comedy
Salim Akil,Jordin Sparks,Whitney Houston,Derek Luke,Drama Music,sparkle,Jordin Sparks Whitney Houston Derek Luke Salim Akil Drama Music
Craig Zobel,Ann Dowd,Dreama Walker,Pat Healy,Drama Thriller,compliance,Ann Dowd Dreama Walker Pat Healy Craig Zobel Drama Thriller
David Cronenberg,Robert Pattinson,Juliette Binoche,Sarah Gadon,Drama,cosmopolis,Robert Pattinson Juliette Binoche Sarah Gadon David Cronenberg Drama
Jake Schreier,Frank Langella,Susan Sarandon,James Marsden,Science Fiction Comedy Drama Crime,robot & frank,Frank Langella Susan Sarandon James Marsden Jake Schreier Science Fiction Comedy Drama Crime
Dax Shepard (director/screenplay); David Palmer,David Palmer (director); Dax Shepard,Kristen Bell,Bradley Cooper,Action Comedy Romance,hit and run,David Palmer (director); Dax Shepard Kristen Bell Bradley Cooper Dax Shepard (director/screenplay); David Palmer Action Comedy Romance
Todd Lincoln,Ashley Greene,Sebastian Stan,Tom Felton,Horror Thriller,the apparition,Ashley Greene Sebastian Stan Tom Felton Todd Lincoln Horror Thriller
David Koepp,Joseph Gordon-Levitt,Michael Shannon,Dania Ramirez,Crime Action Thriller,premium rush,Joseph Gordon-Levitt Michael Shannon Dania Ramirez David Koepp Crime Action Thriller
John Hillcoat,Shia LaBeouf,Tom Hardy,Jason Clarke,Crime Drama Western,lawless,Shia LaBeouf Tom Hardy Jason Clarke John Hillcoat Crime Drama Western
Matthew Diamond,Toni Braxton,Cloris Leachman,Christopher Lloyd,Family,the oogieloves in the big balloon adventure,Toni Braxton Cloris Leachman Christopher Lloyd Matthew Diamond Family
Mads Brügger,Mads Brügger (director),unknown,unknown,Documentary,the ambassador,Mads Brügger (director) unknown unknown Mads Brügger Documentary
Ole Bornedal,Jeffrey Dean Morgan,Kyra Sedgwick,unknown,Horror Thriller,the possession,Jeffrey Dean Morgan Kyra Sedgwick unknown Ole Bornedal Horror Thriller
Jamie Travis,Ari Graynor,Seth Rogen,Lauren Anne Miller,Comedy Drama,"for a good time, call...",Ari Graynor Seth Rogen Lauren Anne Miller Jamie Travis Comedy Drama
Mabrouk El Mechri,Henry Cavill,Bruce Willis,Sigourney Weaver,Action Thriller Mystery,the cold light of day,Henry Cavill Bruce Willis Sigourney Weaver Mabrouk El Mechri Action Thriller Mystery
"Brian Klugman, Lee Sternthal",Bradley Cooper,Jeremy Irons,Zoe Saldana,Drama Thriller,the words,"Bradley Cooper Jeremy Irons Zoe Saldana Brian Klugman, Lee Sternthal Drama Thriller"
Joe Wright,Keira Knightley,Jude Law,Aaron Johnson,Drama Romance,anna karenina,Keira Knightley Jude Law Aaron Johnson Joe Wright Drama Romance
"Heidi Ewing, Rachel Grady",Heidi Ewing,Rachel Grady (directors),unknown,Documentary,detropia,"Heidi Ewing Rachel Grady (directors) unknown Heidi Ewing, Rachel Grady Documentary"
Paul W. S. Anderson,Milla Jovovich,Sienna Guillory,Colin Salmon,Action Horror Science Fiction,resident evil: retribution,Milla Jovovich Sienna Guillory Colin Salmon Paul W. S. Anderson Action Horror Science Fiction
Andrew Stanton (director/screenplay); Lee Unkrich,Alexander Gould,Albert Brooks,Ellen DeGeneres,Animation Family,finding nemo 3d,Alexander Gould Albert Brooks Ellen DeGeneres Andrew Stanton (director/screenplay); Lee Unkrich Animation Family
Nicholas Jarecki,Richard Gere,Susan Sarandon,Tim Roth,Drama Thriller,arbitrage,Richard Gere Susan Sarandon Tim Roth Nicholas Jarecki Drama Thriller
"Anurag Basu (Director/Screenplay); Ranbir Kapoor, Priyanka Chopra, Ileana D'Cruz",Anurag Basu (Director/Screenplay); Ranbir Kapoor,Priyanka Chopra,Ileana D'Cruz,Drama Romance Comedy,barfi!,"Anurag Basu (Director/Screenplay); Ranbir Kapoor Priyanka Chopra Ileana D'Cruz Anurag Basu (Director/Screenplay); Ranbir Kapoor, Priyanka Chopra, Ileana D'Cruz Drama Romance Comedy"
Paul Thomas Anderson,Philip Seymour Hoffman,Joaquin Phoenix,Jesse Plemons,Drama,the master,Philip Seymour Hoffman Joaquin Phoenix Jesse Plemons Paul Thomas Anderson Drama
Simon West,Nicolas Cage,Malin Åkerman,Josh Lucas,Action Crime Thriller,stolen,Nicolas Cage Malin Åkerman Josh Lucas Simon West Action Crime Thriller
Michael Haneke,Jean-Louis Trintignant,Emmanuelle Riva,unknown,Drama Romance,amour,Jean-Louis Trintignant Emmanuelle Riva unknown Michael Haneke Drama Romance
Pete Travis,Karl Urban,Olivia Thirlby,Lena Headey,Action Science Fiction,dredd,Karl Urban Olivia Thirlby Lena Headey Pete Travis Action Science Fiction
David Ayer,Jake Gyllenhaal,Michael Peña,Anna Kendrick,Crime Drama Thriller,end of watch,Jake Gyllenhaal Michael Peña Anna Kendrick David Ayer Crime Drama Thriller
Mark Tonderai,Jennifer Lawrence,Elisabeth Shue,Max Thieriot,Horror Thriller,house at the end of the street,Jennifer Lawrence Elisabeth Shue Max Thieriot Mark Tonderai Horror Thriller
Robert Lorenz,Clint Eastwood,Amy Adams,Matthew Lillard,Drama Romance,trouble with the curve,Clint Eastwood Amy Adams Matthew Lillard Robert Lorenz Drama Romance
"Lisa Immordino Vreeland, Bent-Jorgan Perlmutt, Frederic Tcheng",Lisa Immordino Vreeland,Bent-Jorgan Perlmutt,Frederic Tcheng (directors);,Documentary,diana vreeland: the eye has to travel,"Lisa Immordino Vreeland Bent-Jorgan Perlmutt Frederic Tcheng (directors); Lisa Immordino Vreeland, Bent-Jorgan Perlmutt, Frederic Tcheng Documentary"
Steve James,Steve James (director); Christopher Nowinski,Bob Costas,Keith Primeau,Documentary,head games,Steve James (director); Christopher Nowinski Bob Costas Keith Primeau Steve James Documentary
Stephen Chbosky,Emma Watson,Logan Lerman,Mae Whitman,Drama,the perks of being a wallflower,Emma Watson Logan Lerman Mae Whitman Stephen Chbosky Drama
"Bernard Knowles, The Beatles",John,Paul,George,Music,magical mystery tour,"John Paul George Bernard Knowles, The Beatles Music"
Genndy Tartakovsky,Adam Sandler,Andy Samberg,Selena Gomez,Animation Family Fantasy Comedy Adventure,hotel transylvania,Adam Sandler Andy Samberg Selena Gomez Genndy Tartakovsky Animation Family Fantasy Comedy Adventure
Rian Johnson,Joseph Gordon-Levitt,Bruce Willis,Emily Blunt,Action Thriller Science Fiction,looper,Joseph Gordon-Levitt Bruce Willis Emily Blunt Rian Johnson Action Thriller Science Fiction
Daniel Barnz,Viola Davis,Maggie Gyllenhaal,Holly Hunter,Drama,won't back down,Viola Davis Maggie Gyllenhaal Holly Hunter Daniel Barnz Drama
Peter Nicks,Peter Nicks (director);,unknown,unknown,Drama Documentary Romance,the waiting room,Peter Nicks (director); unknown unknown Peter Nicks Drama Documentary Romance
Tim Burton,Catherine O'Hara,Martin Short,Martin Landau,Animation Comedy Family,frankenweenie,Catherine O'Hara Martin Short Martin Landau Tim Burton Animation Comedy Family
Jason Moore,Anna Kendrick,Anna Camp,Rebel Wilson,Comedy Music Romance,pitch perfect,Anna Kendrick Anna Camp Rebel Wilson Jason Moore Comedy Music Romance
Olivier Megaton,Liam Neeson,Famke Janssen,Maggie Grace,Action Crime Thriller,taken 2,Liam Neeson Famke Janssen Maggie Grace Olivier Megaton Action Crime Thriller
Don Hertzfeldt,Don Hertzfeldt (director/screenplay),unknown,unknown,Drama Animation,it's such a beautiful day,Don Hertzfeldt (director/screenplay) unknown unknown Don Hertzfeldt Drama Animation
Julian Farino,Hugh Laurie,Leighton Meester,Catherine Keener,Comedy Romance Drama,the oranges,Hugh Laurie Leighton Meester Catherine Keener Julian Farino Comedy Romance Drama
Lee Daniels,Zac Efron,Matthew McConaughey,Nicole Kidman,Thriller Drama Mystery,the paperboy,Zac Efron Matthew McConaughey Nicole Kidman Lee Daniels Thriller Drama Mystery
Ben Affleck,Ben Affleck,John Goodman,Alan Arkin,Drama Thriller,argo,Ben Affleck John Goodman Alan Arkin Ben Affleck Drama Thriller
Frank Coraci,Kevin James,Salma Hayek,Henry Winkler,Comedy Action,here comes the boom,Kevin James Salma Hayek Henry Winkler Frank Coraci Comedy Action
Martin McDonagh,Colin Farrell,Michael Pitt,Michael Stuhlbarg,Comedy Crime,seven psychopaths,Colin Farrell Michael Pitt Michael Stuhlbarg Martin McDonagh Comedy Crime
Scott Derrickson,Ethan Hawke,Juliet Rylance,Fred Thompson,Horror Thriller Mystery,sinister,Ethan Hawke Juliet Rylance Fred Thompson Scott Derrickson Horror Thriller Mystery
Ry Russo-Young,John Krasinski,Olivia Thirlby,Rosemarie DeWitt,Drama,nobody walks,John Krasinski Olivia Thirlby Rosemarie DeWitt Ry Russo-Young Drama
James Ponsoldt,Mary Elizabeth Winstead,Aaron Paul,Octavia Spencer,Comedy Drama,smashed,Mary Elizabeth Winstead Aaron Paul Octavia Spencer James Ponsoldt Comedy Drama
Leos Carax,Denis Lavant,Édith Scob,Eva Mendes,Drama Fantasy,holy motors,Denis Lavant Édith Scob Eva Mendes Leos Carax Drama Fantasy
Rob Cohen,Tyler Perry,Matthew Fox,Rachel Nichols,Action Thriller Crime Mystery,alex cross,Tyler Perry Matthew Fox Rachel Nichols Rob Cohen Action Thriller Crime Mystery
"Ariel Schulman, Henry Joost",Kathryn Newton,Matt Shively,Stephen Dunham,Horror,paranormal activity 4,"Kathryn Newton Matt Shively Stephen Dunham Ariel Schulman, Henry Joost Horror"
Ben Lewin,John Hawkes,Helen Hunt,William H. Macy,Drama Romance Comedy,the sessions,John Hawkes Helen Hunt William H. Macy Ben Lewin Drama Romance Comedy
"Curtis Hanson, Michael Apted",Gerard Butler,Jonny Weston,Elisabeth Shue,Drama,chasing mavericks,"Gerard Butler Jonny Weston Elisabeth Shue Curtis Hanson, Michael Apted Drama"
"Tom Tykwer, Lilly Wachowski, Lana Wachowski",Tom Hanks,Jim Sturgess,David Gyasi,Drama Science Fiction,cloud atlas,"Tom Hanks Jim Sturgess David Gyasi Tom Tykwer, Lilly Wachowski, Lana Wachowski Drama Science Fiction"
Josh Schwartz,Victoria Justice,Jane Levy,Thomas McDonell,Comedy,fun size,Victoria Justice Jane Levy Thomas McDonell Josh Schwartz Comedy
Michael J. Bassett,Adelaide Clemens,Sean Bean,Radha Mitchell,Thriller Horror Mystery,silent hill: revelation,Adelaide Clemens Sean Bean Radha Mitchell Michael J. Bassett Thriller Horror Mystery
Sam Mendes,Daniel Craig,Ralph Fiennes,Judi Dench,Action Adventure Thriller,skyfall,Daniel Craig Ralph Fiennes Judi Dench Sam Mendes Action Adventure Thriller
Luis Prieto,Richard Coyle,Zlatko Burić,unknown,Action Crime Drama Thriller,pusher,Richard Coyle Zlatko Burić unknown Luis Prieto Action Crime Drama Thriller
Robert Zemeckis,Denzel Washington,Brian Geraghty,Nadine Velazquez,Drama,flight,Denzel Washington Brian Geraghty Nadine Velazquez Robert Zemeckis Drama
RZA,Russell Crowe,Lucy Liu,Dave Bautista,Action,the man with the iron fists,Russell Crowe Lucy Liu Dave Bautista RZA Action
Rich Moore,John C. Reilly,Sarah Silverman,Jack McBrayer,Family Animation Comedy Adventure,wreck-it ralph,John C. Reilly Sarah Silverman Jack McBrayer Rich Moore Family Animation Comedy Adventure
Kerry Bellessa,Summer Bellessa,Chris Hill,Jasen Wade,Horror Mystery Thriller,amber alert,Summer Bellessa Chris Hill Jasen Wade Kerry Bellessa Horror Mystery Thriller
Barry Levinson,Will Rogers,Kristen Connolly,Kether Donohue,Horror Science Fiction Thriller,the bay,Will Rogers Kristen Connolly Kether Donohue Barry Levinson Horror Science Fiction Thriller
Jacob Aaron Estes,Jacob Aaron Estes (director); Tobey Maguire,Elizabeth Banks,Dennis Haysbert,Comedy Drama,the details,Jacob Aaron Estes (director); Tobey Maguire Elizabeth Banks Dennis Haysbert Jacob Aaron Estes Comedy Drama
Yaron Zilberman,Philip Seymour Hoffman,Catherine Keener,Christopher Walken,Music Drama,a late quartet,Philip Seymour Hoffman Catherine Keener Christopher Walken Yaron Zilberman Music Drama
"Bill Jones, Jeff Simpson, Ben Timlett",Bill Jones,Jeff Simpson,Ben Timlett (directors); Graham Chapman,Animation Comedy,a liar's autobiography,"Bill Jones Jeff Simpson Ben Timlett (directors); Graham Chapman Bill Jones, Jeff Simpson, Ben Timlett Animation Comedy"
Bavo Defurne,Bavo Defurne (director); Jelle Florizoone,Mathias Vergels,Eva Van Der Gucht,Drama Romance,north sea texas,Bavo Defurne (director); Jelle Florizoone Mathias Vergels Eva Van Der Gucht Bavo Defurne Drama Romance
Paolo Sorrentino,Sean Penn,Frances McDormand,unknown,Drama,this must be the place,Sean Penn Frances McDormand unknown Paolo Sorrentino Drama
Jeremy Power Regimbal,Selma Blair,James D'Arcy,unknown,Horror Thriller,in their skin,Selma Blair James D'Arcy unknown Jeremy Power Regimbal Horror Thriller
Steven Spielberg,Daniel Day-Lewis,David Strathairn,Hal Holbrook,Action Fantasy Horror,lincoln,Daniel Day-Lewis David Strathairn Hal Holbrook Steven Spielberg Action Fantasy Horror
Yash Chopra,Shahrukh Khan,Anushka Sharma,Katrina Kaif,Drama Romance,jab tak hai jaan,Shahrukh Khan Anushka Sharma Katrina Kaif Yash Chopra Drama Romance
Bill Condon,Kristen Stewart,Robert Pattinson,Michael Sheen,Adventure Fantasy Drama Romance,the twilight saga: breaking dawn – part 2,Kristen Stewart Robert Pattinson Michael Sheen Bill Condon Adventure Fantasy Drama Romance
Jeff Orlowski,Jeff Orlowski (director),unknown,unknown,Documentary,chasing ice,Jeff Orlowski (director) unknown unknown Jeff Orlowski Documentary
David O. Russell,Bradley Cooper,Jennifer Lawrence,Brea Bee,Drama Comedy Romance,silver linings playbook,Bradley Cooper Jennifer Lawrence Brea Bee David O. Russell Drama Comedy Romance
Ang Lee,Suraj Sharma,Ayush Tandon,Irrfan Khan,Adventure Drama Action,life of pi,Suraj Sharma Ayush Tandon Irrfan Khan Ang Lee Adventure Drama Action
Dan Bradley,Will Yun Lee,Chris Hemsworth,Josh Peck,Action Thriller,red dawn,Will Yun Lee Chris Hemsworth Josh Peck Dan Bradley Action Thriller
Peter Ramsey,Chris Pine,Alec Baldwin,Hugh Jackman,Family Animation Fantasy Action Adventure,rise of the guardians,Chris Pine Alec Baldwin Hugh Jackman Peter Ramsey Family Animation Fantasy Action Adventure
Debbie Isitt,Debbie Isitt (director); David Tennant,Joanna Page,Marc Wootton,Comedy Family,nativity 2: danger in the manger,Debbie Isitt (director); David Tennant Joanna Page Marc Wootton Debbie Isitt Comedy Family
Sacha Gervasi,Anthony Hopkins,Helen Mirren,Michael Wincott,Drama,hitchcock,Anthony Hopkins Helen Mirren Michael Wincott Sacha Gervasi Drama
Marcus Dunstan,Josh Stewart,Emma Fitzpatrick,unknown,Horror Thriller,the collection,Josh Stewart Emma Fitzpatrick unknown Marcus Dunstan Horror Thriller
Andrew Dominik,Brad Pitt,Vincent Curatola,Scoot McNairy,Crime Thriller,killing them softly,Brad Pitt Vincent Curatola Scoot McNairy Andrew Dominik Crime Thriller
Gabriele Muccino,Gerard Butler,Uma Thurman,Jessica Biel,Comedy Romance,playing for keeps,Gerard Butler Uma Thurman Jessica Biel Gabriele Muccino Comedy Romance
Matthew Spradlin,Matthew Spradlin (director); Amanda Alch,Marc Donato,Augie Duke,Comedy Mystery Thriller Horror,bad kids go to hell,Matthew Spradlin (director); Amanda Alch Marc Donato Augie Duke Matthew Spradlin Comedy Mystery Thriller Horror
Donald Rice,Felicity Jones,Luke Treadaway,Elizabeth McGovern,Drama Comedy Romance,cheerful weather for the wedding,Felicity Jones Luke Treadaway Elizabeth McGovern Donald Rice Drama Comedy Romance
Stefan Ruzowitzky,Eric Bana,Olivia Wilde,Charlie Hunnam,Crime Drama Thriller,deadfall,Eric Bana Olivia Wilde Charlie Hunnam Stefan Ruzowitzky Crime Drama Thriller
"Yoon-suk Choi, John Kafka",Jane Lynch,Rob Schneider,Stephen Baldwin,Animation Adventure Comedy Family,dino time,"Jane Lynch Rob Schneider Stephen Baldwin Yoon-suk Choi, John Kafka Animation Adventure Comedy Family"
Edward Burns (director/produced/written); Kerry Bishé; Heather Burns; Connie Britton; Caitlin FitzGerald; Anita Gillette; Tom Guiry; Ed Lauter; Mike McGlone; Noah Emmerich,Edward Burns (director/produced/written); Kerry Bishé; Heather Burns; Connie Britton; Caitlin FitzGerald; Anita Gillette; Tom Guiry; Ed Lauter; Mike McGlone; Noah Emmerich,unknown,unknown,Drama Family,the fitzgerald family christmas,Edward Burns (director/produced/written); Kerry Bishé; Heather Burns; Connie Britton; Caitlin FitzGerald; Anita Gillette; Tom Guiry; Ed Lauter; Mike McGlone; Noah Emmerich unknown unknown Edward Burns (director/produced/written); Kerry Bishé; Heather Burns; Connie Britton; Caitlin FitzGerald; Anita Gillette; Tom Guiry; Ed Lauter; Mike McGlone; Noah Emmerich Drama Family
Jose Henrique Fonseca,Rodrigo Santoro,unknown,unknown,Drama History,heleno,Rodrigo Santoro unknown unknown Jose Henrique Fonseca Drama History
Roger Michell,Bill Murray,Laura Linney,Olivia Williams,Comedy Drama History,hyde park on hudson,Bill Murray Laura Linney Olivia Williams Roger Michell Comedy Drama History
Stephen Frears,Bruce Willis,Rebecca Hall,Catherine Zeta-Jones,Drama Comedy,lay the favorite,Bruce Willis Rebecca Hall Catherine Zeta-Jones Stephen Frears Drama Comedy
Peter Jackson,Richard Armitage,Ian McKellen,Martin Freeman,Adventure Fantasy Action,the hobbit: an unexpected journey,Richard Armitage Ian McKellen Martin Freeman Peter Jackson Adventure Fantasy Action
Anne Fletcher,Barbra Streisand,Seth Rogen,Brett Cullen,Comedy,the guilt trip,Barbra Streisand Seth Rogen Brett Cullen Anne Fletcher Comedy
Kathryn Bigelow,Jessica Chastain,Chris Pratt,Joel Edgerton,Thriller Drama History,zero dark thirty,Jessica Chastain Chris Pratt Joel Edgerton Kathryn Bigelow Thriller Drama History
Andrew Adamson,Erica Linz,Igor Zaripov,John Clarke,Fantasy Family Music Drama,cirque du soleil: worlds away,Erica Linz Igor Zaripov John Clarke Andrew Adamson Fantasy Family Music Drama
Christopher McQuarrie,Tom Cruise,Rosamund Pike,David Oyelowo,Crime Drama Thriller Action,jack reacher,Tom Cruise Rosamund Pike David Oyelowo Christopher McQuarrie Crime Drama Thriller Action
Judd Apatow,Paul Rudd,Leslie Mann,Maude Apatow,Comedy,this is 40,Paul Rudd Leslie Mann Maude Apatow Judd Apatow Comedy
Juan Antonio Bayona,Naomi Watts,Ewan McGregor,unknown,Thriller Drama,the impossible,Naomi Watts Ewan McGregor unknown Juan Antonio Bayona Thriller Drama
David Chase,Brad Garrett,James Gandolfini,Bella Heathcote,Drama,not fade away,Brad Garrett James Gandolfini Bella Heathcote David Chase Drama
